candidate_uuid	parent_candidate_uuid	iteration	candidate_label	feasible	eval_throughput	objective_mean	objective_ci_95	measurement_count	window_completed	no_oom_events	reasoning_content_purity	determinism_pass_rate	status	notes
9a8c976f-f600-4d2c-afe4-2d1dd4750195		baseline_a	baseline_a	true	0.02064			1	true	true	1.0	1.0	baseline	default-config baseline replay a
21ba272f-1ab0-41ad-adeb-76dec57a0969		baseline_b	baseline_b	true	0.02463			1	true	true	1.0	1.0	baseline	default-config baseline replay b
e370036d-8ee0-4aa2-83b9-8585fb6010bc		001	candidate-001	true	0.016988			1	true	true	1.0	1.0	discard	Feasible RealMeasurementHarness trace at sustained_concurrency 3, but eval_throughput 0.016988 over 235.46s trailed baseline_a 0.02064 and baseline_b 0.02463.
3d5bbf70-524e-43d2-bafb-4870fab356f1		002	candidate-002	true	0.022839			1	true	true	1.0	1.0	keep	Feasible RealMeasurementHarness trace at sustained_concurrency 4 with eval_throughput 0.022839, no OOMs, and no harness warnings; recovered from the 3-way cap regression and stayed within baseline replay band.
20708b4a-44b2-4184-85aa-2f7483cde70a		003	candidate-003	true	0.024701			1	true	true	1.0	1.0	keep	Feasible RealMeasurementHarness trace at sustained_concurrency 4 with eval_throughput 0.024701, no OOMs, no harness warnings, and best throughput so far.
64dab9ec-9136-4c5c-bde2-a33e13f05e88		004	candidate-004	true	0.024884			1	true	true	1.0	1.0	keep	Feasible RealMeasurementHarness trace at sustained_concurrency 4 with eval_throughput 0.024884, no OOMs, no harness warnings, and best throughput so far.
a32be108-e6c8-4c43-b120-e2d5fc566615		005	candidate-005	true	0.024105			1	true	true	1.0	1.0	discard	Clean RealMeasurementHarness run at sustained_concurrency 4 with no OOMs or warnings, but eval_throughput 0.024105 regressed below candidate-004's 0.024884 and baseline_b's 0.02463.
423b2ecf-4406-4f92-9ba4-caeff9a08d0a		006	candidate-006	true	0.023073			1	true	true	1.0	1.0	discard	Feasible RealMeasurementHarness run at sustained_concurrency 4 with no OOMs or warnings, but eval_throughput 0.023073 regressed below candidate-004's 0.024884 and baseline_b's 0.02463.
81fccef6-1789-40b0-b985-4990edf66389		007	candidate-007	true	0.023065			1	true	true	1.0	1.0	discard	Feasible RealMeasurementHarness trace at sustained_concurrency 4 with no OOMs or warnings, but eval_throughput 0.023065 remained below candidate-004's 0.024884 and baseline_b's 0.02463.
e23194fe-121a-4115-842c-00a649288712		008	candidate-008	true	0.024178			1	true	true	1.0	1.0	discard	Feasible RealMeasurementHarness trace at sustained_concurrency 4 with no OOMs or warnings, but eval_throughput 0.024178 remained below candidate-004's 0.024884 and baseline_b's 0.02463.
